{"action":"place","canonical_instrument_id":"NSE:NSE_FNO:NIFTY:option:2026-08-27:25000:CE","created_at_ns":100,"execution_session_id":"00000000-0000-4000-8000-000000000003","expires_at_ns":200,"intent_id":"00000000-0000-4000-8000-000000000001","limit_price_paise":25000,"product":"NRML","quantity":65,"schema_version":"1.0.0","side":"BUY","strategy_id":"d51","strategy_run_id":"00000000-0000-4000-8000-000000000002","time_in_force":"DAY"}
